wh3p2a,k_woz1978,"2022/08/06, 00:41:12",https://www.reddit.com/r/dadjokes/comments/wh3p2a/if_a_serial_killer_is_chasing_you/,If a serial killer is chasing you......,you're both running for your life.
whehid,MaggieMcB,"2022/08/06, 09:07:09",https://www.reddit.com/r/dadjokes/comments/whehid/my_wife_why_dont_you_stop_telling_terrible_dad/,My wife: Why don’t you stop telling terrible dad jokes and write a book instead’,"Me ‘Oh, that’s a novel idea"
wh4p1b,paulvs88,"2022/08/06, 01:24:14",https://www.reddit.com/r/dadjokes/comments/wh4p1b/what_is_so_great_about_that_whiteboard/,What is so great about that whiteboard?,It's remarkable.
wgmr0t,DatabaseSolid,"2022/08/05, 10:45:32",https://www.reddit.com/r/dadjokes/comments/wgmr0t/these_lax_bail_laws_are_making_criminals_more/,These lax bail laws are making criminals more bold and dangerous! Last week one of these guys even stole the toilets at the local precinct.,Right now the police have nothing to go on.
wh43qm,YZXFILE,"2022/08/06, 00:58:39",https://www.reddit.com/r/dadjokes/comments/wh43qm/my_dad_drives_so_slow_that_when_were_on_the/,"My dad drives so slow that when we’re on the highway,", Amish people give us the finger.
wgo7rv,Appropriate-Horse-80,"2022/08/05, 12:09:32",https://www.reddit.com/r/dadjokes/comments/wgo7rv/why_can_you_never_hear_pterodactyls_use_the/,Why can you never hear pterodactyls use the bathroom?,"... Because the ""p"" is silent"
wh35gg,Ilyathe2nd,"2022/08/06, 00:18:26",https://www.reddit.com/r/dadjokes/comments/wh35gg/interviewer_where_do_you_see_yourself_in_5_years/,Interviewer: Where do you see yourself in 5 years?,"Same as now. Windows, mirrors, other reflective surfaces like that."
whd1kc,wimpykidfan37,"2022/08/06, 07:50:38",https://www.reddit.com/r/dadjokes/comments/whd1kc/conjunctivitiscom/,Conjunctivitis.com,That's a site for sore eyes.
wh0dvl,Uvalde-Cop,"2022/08/05, 22:22:40",https://www.reddit.com/r/dadjokes/comments/wh0dvl/i_love_carbonated_drinks_but_i_really_hate_having/,I love carbonated drinks. But I really hate having to crush the empty cans afterward.,It's soda pressing!
wgt9r3,Flat_Turn2530,"2022/08/05, 17:11:04",https://www.reddit.com/r/dadjokes/comments/wgt9r3/where_do_sheep_like_to_go_on_vacation/,Where do sheep like to go on vacation?,The Baa-hamas.
